<?xml version="1.0" encoding="UTF-8"?>
<employee xmlns:X="xxx" X:schemaLocation="schema.xsd">
	<name>Ashish</name>
	<id>13089</id>
	<add>
		<city>patna</city>
		<pincode>11111</pincode>
	</add>
	<name>Ashish</name>
	<id>13089</id>
	<add>
		<city>patna</city>
		<pincode>11111</pincode>
	</add>
	<name>Ashish</name>
	<id>13089</id>
	<add>
		<city>patna</city>
		<pincode>11111</pincode>
	</add>
</employee>